{
  "schemaVersion": "1.0",
  "ideaLock": "idea-archipelago-orchestrator",
  "frozenAt": "2026-07-07T18:00:00Z",
  "planDoc": "docs/ARCHIPELAGO-Plan-of-Attack-2026-07-07.html",
  "verdict": { "nbcli": "ready", "nbcliReport": "ops/mission/evidence/G1-nsb-preview.txt", "adversarialFindingsResolved": true },
  "phases": [
    {
      "id": "P0",
      "title": "Gate contracts land in mission-control",
      "goal": "Kickoff consumes idea.lock + plan.lock; state.json carries the archipelago block.",
      "sessionsEstimate": "1-2",
      "lane": "feature",
      "gates": [
        { "id": "P0-G1", "title": "All five schemas validate against draft 2020-12", "command": "python3 scripts/validate_contracts.py" },
        { "id": "P0-G2", "title": "Example instances validate against their schemas", "command": "python3 scripts/validate_examples.py" }
      ],
      "evidenceRequired": ["static"]
    },
    {
      "id": "P1",
      "title": "dogfood-readiness v2 runtime lanes",
      "goal": "Playwright journey/visual/recording lanes wired; UI claims cannot reach band 5 without runtime artifacts.",
      "sessionsEstimate": "2-3",
      "lane": "feature",
      "gates": [
        { "id": "P1-G1", "title": "Runtime probe runner produces normalized artifacts", "command": "python3 scripts/run_runtime_probes.py --self-test" }
      ],
      "evidenceRequired": ["static", "runtime-journey", "recording"]
    }
  ],
  "budget": { "costCapUsd": 150, "wallClockCapHours": 20, "notes": "Sabbath window excluded from scheduling Fri sunset - Sat sunset." },
  "hitl": { "approvedBy": "jon-isaac", "approvedAt": "2026-07-07T18:05:00Z", "conditions": ["No apply-decisions on BranchSweeper without per-repo approval"] }
}
